94	llevar	to take, carry	llevo, llevas, lleva, llevamos, lleváis, llevan	verb	Yo llevo una mochila.	I carry a backpack.	llevar		
101	encontrar	to find	encuentro, encuentras, encuentra, encontramos, encontráis, encuentran	verb	Yo encuentro una solución.	I find a solution.	encontrar		
106	venir	to come	vengo, vienes, viene, venimos, venís, vienen	verb	Vengo a la fiesta.	I come to the party.	venir		
140	último	last, final		adjective	Es el último día del año.	It is the last day of the year.	último		
154	cual	which, who, whom		adjective	¿Cual es tu nombre?	Which is your name?	cual		
161	solo	only, lonely, alone		adjective	Solo salgo a la calle cuando hay sol.	I only go outside when there is sun.	solo		